entropy,text,zscore,watermarking_scheme,model,time
1,"system

You are a helpful personal assistant.user

Write a 250-word story:assistant

As I stepped off the train, the crisp mountain air enveloped me, a welcome respite from the hustle and bustle of city life. I had been looking forward to this solo retreat for weeks, and the peacefulness of the surroundings immediately put me at ease.

I had rented a small cabin on the outskirts of town, surrounded by towering trees and a babbling brook. The owner, a kind old man named Jack, had left a note with instructions on how to get settled in. As I unpacked, I noticed a small basket on the kitchen counter filled with freshly baked cookies and a handwritten note that read: ""Welcome to your home away from home. Enjoy your stay!""

I spent the day hiking through the nearby woods, taking in the vibrant colors of the changing leaves. As the sun began to set, I curled up on the couch with a good book and a cup of hot tea. The sound of the wind rustling through the trees and the crackling of the fireplace created a soothing melody that lulled me into a state of deep relaxation.

As I drifted off to sleep, I felt grateful for this chance to unplug and recharge. The cabin was a haven, a place to escape the stresses of everyday life and reconnect with nature. I knew that this was exactly what I needed – a chance to breathe, to reflect, and to rediscover myself. As I settled in for the night, I felt a sense of peace wash over me, knowing that this retreat would be a journey of self-discovery and growth.",2.480930308889871,umd,hugging-quants/Meta-Llama-3.1-70B-Instruct-AWQ-INT4,30.102155447006226
2,"system

You are a helpful personal assistant.user

Write a 250-word story that takes place in Paris:assistant

As I strolled along the Seine, the soft golden light of the setting sun danced across the water, casting a romantic glow over the city. I had always been enchanted by Paris, and tonight was no exception. My friend, Sophie, and I had decided to take a break from our busy schedules and indulge in a leisurely evening stroll.

We wandered past the majestic Notre-Dame Cathedral, its Gothic spires reaching towards the sky like giant stone fingers. We paused at a charming street performer who was juggling clubs and spinning plates, his music and laughter drawing a crowd of onlookers.

As we continued our promenade, the scent of freshly baked croissants wafted from a nearby patisserie, tempting us to stop and sample the flaky, buttery treats. We succumbed to the temptation, savoring the delicious pastry and watching the world go by from a sidewalk café.

As the stars began to twinkle above, we made our way to the Eiffel Tower, its iron latticework gleaming like a giant metal spider in the fading light. We rode the elevator to the top, where the breathtaking view took our breath away. The city stretched out before us like a glittering tapestry, with the Seine snaking its way through the heart of Paris.

As we gazed out at the magical scene, Sophie turned to me and said, ""C'est magnifique, n'est-ce pas?"" I couldn't help but agree. This was, indeed, the city of love and beauty, where even a simple evening stroll became an unforgettable experience.",2.4157265719275856,umd,hugging-quants/Meta-Llama-3.1-70B-Instruct-AWQ-INT4,29.762721300125122
3,"system

You are a helpful personal assistant.user

Write a 250-word story about Evan, who falls for Emilie in Paris:assistant

Evan's eyes wandered along the charming streets of Montmartre, taking in the vibrant street performers, quaint cafes, and historic architecture of Paris. As a solo traveler, he had been exploring the city for days, but nothing had captured his heart quite like the charming smile of a young woman he spotted at a small bakery. Her name was Emilie, and she was a pastry chef with a quick wit and infectious laugh.

As Evan watched, Emilie expertly crafted delicate macarons and chatted with the regular customers. He mustered up the courage to order a croissant and introduced himself. Their conversation flowed easily, like the Seine River, and before he knew it, they'd talked for hours about art, music, and life.

As the sun began to set, casting a golden glow over the city, Emilie suggested a walk along the river. Evan eagerly agreed, and they strolled hand in hand, taking in the sights and sounds of the city. They stopped at a street performer who was playing a beautiful melody on his accordion, and Emilie began to dance, twirling and spinning to the music.

Evan's heart skipped a beat as he watched her, captivated by her carefree spirit and beauty. As the music came to an end, Emilie turned to him with a smile, and Evan knew in that moment that he was smitten. ""Je t'aime Paris,"" he said, looking into her eyes, ""but most of all, je t'aime toi."" Emilie's cheeks flushed, and she leaned in close, her lips brushing against his in a gentle kiss. As the city lights twinkled around them, Evan knew that this was just the beginning of their Parisian romance.",2.667543715421401,umd,hugging-quants/Meta-Llama-3.1-70B-Instruct-AWQ-INT4,32.28497648239136
1,"As I stepped off the train and onto the bustling platform, I felt a wave of anxiety wash over me. I had just received an email from my boss informing me that I had a critical meeting in 30 minutes, and I still needed to grab a cup of coffee and review my notes. I quickened my pace, weaving in and out of the crowded station, when I suddenly felt a gentle tug on my arm.

It was my personal assistant, Emily. She had been tracking my schedule and had anticipated my chaotic morning. ""Hey, boss! I've got you covered,"" she said with a warm smile, handing me a steaming cup of coffee and a neatly printed copy of my meeting notes. ""I also booked an Uber to take you to your meeting, it's waiting outside.""

I was taken aback by Emily's thoughtfulness and attention to detail. As we made our way to the car, she briefed me on the latest developments related to the meeting, ensuring I was fully prepared. We arrived at the conference room with minutes to spare, and I felt a sense of calm wash over me.

The meeting went smoothly, and my confidence was boosted by Emily's behind-the-scenes work. As we left the conference room, I turned to her and said, ""You're a lifesaver, Emily. I don't know what I'd do without you!"" She beamed with pride, knowing that her dedication and expertise had made a tangible impact on my day.",3.8361720785460363,umd,hugging-quants/Meta-Llama-3.1-70B-Instruct-AWQ-INT4,27.46838402748108
2,"As I strolled along the Seine, the Eiffel Tower rose above me, its iron latticework gleaming in the morning light. I had always loved Paris, but today felt different. Maybe it was the way the misty rain kissed the cobblestone streets, or the way the smell of freshly baked croissants wafted from the cafes. Whatever it was, I felt like I had stumbled into a fairy tale.

I turned a corner onto the Rue Cler, where charming shops and bistros lined the narrow street. I stopped at a tiny patisserie, where I purchased a flaky, buttery croissant and a café au lait. As I sat at a small table outside, watching the Parisians hurry to start their day, I noticed a young artist setting up her easel across the street.

She caught my eye and smiled, and I couldn't help but return the gesture. We struck up a conversation, and I learned her name was Colette. She was painting the street scene, capturing the vibrant colors and lively atmosphere of the Rue Cler. I watched in awe as she brought the scene to life on her canvas.

As I finished my breakfast and prepared to leave, Colette handed me a small, delicate drawing she had created on a napkin. ""A souvenir of our lovely morning,"" she said with a smile. I thanked her, feeling grateful for the unexpected encounter. As I continued my stroll, the Eiffel Tower looming in the distance, I felt like I had discovered a little bit of Paris magic.",2.5274518033577866,umd,hugging-quants/Meta-Llama-3.1-70B-Instruct-AWQ-INT4,29.581467390060425
1,"As I stepped off the train and onto the bustling platform, I couldn't help but feel a sense of relief wash over me. I had finally made it to Paris, the city of love and light, after months of planning and anticipation. My personal assistant, Sophie, had been instrumental in making this trip a reality, from booking my flights to arranging for a charming little apartment in the Latin Quarter.

As I made my way through the crowded station, Sophie's voice came to me through the comms device on my wrist. ""Welcome to Paris, Madame! I've arranged for a car to take you to your accommodations. Just look for the driver holding a sign with your name.""

I followed Sophie's instructions and soon found myself settling into the backseat of a sleek black sedan. The driver, a charming Frenchman named Pierre, chatted with me in broken English as we navigated the winding streets of the city.

As we pulled up to my apartment, Sophie's voice came to me once again. ""I've left a few recommendations for you to explore the city, Madame. There's a lovely patisserie just around the corner from your apartment, and I've made reservations for you at a Michelin-starred restaurant for dinner tonight.""

I thanked Sophie, feeling grateful for her thoughtfulness and attention to detail. As I settled into my cozy apartment, I couldn't wait to start exploring this enchanting city with Sophie's expert guidance. With her help, I knew this trip was going to be truly unforgettable.",3.60736950617737,umd,hugging-quants/Meta-Llama-3.1-70B-Instruct-AWQ-INT4,28.817488431930542
2,"As I strolled along the Seine, the Eiffel Tower rose majestically above the city. I had always been drawn to the romance of Paris, and tonight was no exception. I had planned a special evening for my friend, Sophie, who was visiting from the States.

We had started the night with a delicious dinner at a quaint bistro in the Latin Quarter, where we feasted on escargots and ratatouille. Now, we were taking a leisurely walk along the river, taking in the twinkling lights of the city.

As we strolled, we came across a group of street performers near the Pont des Arts. A young musician was playing a beautiful melody on his accordion, while a couple danced a lively tango on the cobblestone street. Sophie's eyes sparkled as we watched, mesmerized by the music and the magic of the moment.

I had one more surprise in store for her. We continued our walk until we reached the Champ de Mars, where we had a breathtaking view of the Eiffel Tower. As the clock struck 9 pm, the tower erupted in a dazzling display of lights, twinkling and shimmering in a kaleidoscope of colors. Sophie gasped in wonder, and I couldn't help but smile at her delight. ""C'est magnifique!"" she exclaimed, turning to me with a grin. It was a night to remember, and I was thrilled to have been able to share this special experience with my dear friend in the City of Light.",2.4461845331508694,umd,hugging-quants/Meta-Llama-3.1-70B-Instruct-AWQ-INT4,28.477840423583984
3,"Evan's eyes wandered along the Seine, taking in the twinkling city lights of Paris. As a traveler, he had been to many places, but there was something about this city that felt different. Maybe it was the charming streets, the art-filled museums, or the charming accents, but Evan felt at home. That was when he saw her – Emilie, with her bright smile and effortless style. She was laughing with a friend at a charming café, and Evan was captivated.

For the next few days, Evan found himself wandering the same streets, hoping to catch a glimpse of Emilie again. One afternoon, as he was exploring the Louvre, he stumbled upon her admiring the Mona Lisa. They struck up a conversation, bonding over their shared love of art and history. As they walked along the Seine, Emilie's infectious laughter and sparkling eyes left Evan smitten.

As the days passed, Evan and Emilie spent every spare moment together, exploring the city's hidden gems and sharing stories. They danced under the stars on a moonlit night, and Evan knew he was falling deeply in love. Emilie, with her quick wit and adventurous spirit, had captured his heart. As they strolled along the Seine, Evan realized that Paris had become the city of love – not just for its beauty, but for the way it had brought him and Emilie together. And as they shared a tender kiss under the Eiffel Tower, Evan knew that this was just the beginning of their own love story.",3.748548106030628,umd,hugging-quants/Meta-Llama-3.1-70B-Instruct-AWQ-INT4,28.804707765579224
4,"Evan sipped his café au lait at a charming Parisian café, taking in the charming atmosphere. As he waited for his croissant, he couldn't help but notice the barista, Emilie, with her bright smile and effortless chic. Her dark hair was pulled back in a messy bun, and her eyes sparkled as she expertly crafted each drink.

As he watched her work, Evan found himself feeling more and more captivated. He struck up a conversation, attempting his best high school French, and to his surprise, Emilie responded with a warm laugh. They chatted about everything from art to music, and Evan discovered they shared a passion for Impressionism and French folk music.

As he prepared to leave, Emilie handed him his croissant with a flirtatious smile, saying ""Bon appétit, monsieur."" Evan's heart skipped a beat as he took in the way her eyes crinkled at the corners. He returned to the café every day, ordering the same drink and striking up conversations with Emilie. She showed him hidden gems of the city, from the Musée de Montmartre to a tiny bookstore on the Seine.

As the days passed, Evan found himself falling deeply for Emilie's charming French accent and quick wit. One evening, as they strolled along the Seine, Emilie turned to him and said, ""Je t'aime, Evan."" Evan's heart soared as he realized he felt the same. As the Eiffel Tower twinkled behind them, Evan knew he'd found a love that would last a lifetime, all thanks to a chance encounter at a charming Parisian café.",3.8074980525429485,umd,hugging-quants/Meta-Llama-3.1-70B-Instruct-AWQ-INT4,31.189301252365112
5,"As Evan strolled along the Seine, taking in the vibrant colors and lively atmosphere of the spring festival in Paris, he stumbled upon a quaint little café. The aroma of freshly brewed coffee drew him in, and he pushed open the door to escape the chill of the spring air. That's where he saw her – Emilie, the barista, with her bright smile and sparkling eyes.

Evan was immediately smitten, but tried to play it cool as he ordered a café au lait. Emilie, with her charming French accent, asked about his day, and Evan found himself opening up about his travels. As they chatted, he learned that Emilie was not only beautiful but also kind and passionate about her city.

As he sipped his coffee, Evan couldn't help but steal glances at Emilie, who was expertly juggling multiple orders while laughing with regular customers. He was captivated by her joie de vivre and decided to linger, ordering another drink and striking up conversation again.

Before he knew it, the festival was in full swing, with music drifting in from the streets. Emilie, noticing Evan's interest, invited him to join her for a break outside. As they strolled along the Seine, taking in the twinkling lights and festive atmosphere, Evan realized he was falling for the charming barista. Emilie, too, seemed to be enjoying his company, and Evan left the café that evening with a spring in his step and a date for the following day. As they parted ways, Emilie whispered, ""À demain, Evan,"" leaving him to wonder if this chance encounter might just lead to a love that would last longer than his vacation.",4.0976453817306595,umd,hugging-quants/Meta-Llama-3.1-70B-Instruct-AWQ-INT4,31.699122428894043
6,"As Evan sipped his café au lait at a charming Parisian café, he couldn't help but notice the barista, Emilie, with her bright smile and sparkling eyes. It was a crisp spring morning, and the city was alive with the vibrant colors and sounds of the spring festival. Evan, an American tourist, was captivated by the city's beauty and the warmth of its people.

As he waited for his coffee, Evan struck up a conversation with Emilie, who was delighted to share her knowledge of the city's artistic and architectural gems. They discovered a shared passion for Impressionism and the works of Claude Monet. As they chatted, Evan found himself smitten not only with the city but also with Emilie's charming accent and infectious enthusiasm.

As the days passed, Evan found himself returning to the café, not just for the coffee, but to see Emilie. They would take long walks along the Seine, admiring the city's majestic landmarks and discussing everything from art to music to life. The Eiffel Tower sparkled in the distance as they strolled hand in hand, taking in the city's romantic atmosphere.

As the spring festival reached its peak, Evan and Emilie's connection deepened. They laughed together, explored the city's hidden corners, and discovered a shared love for the Impressionist movement. As the sun set over the Seine, Evan realized he had fallen for the charming barista, and the city of love had worked its magic once again.",4.230298433515218,umd,hugging-quants/Meta-Llama-3.1-70B-Instruct-AWQ-INT4,28.305144548416138
7,"Evan's eyes wandered as he waited in line at a charming Parisian café, where the aroma of freshly brewed coffee filled the air. That's when he saw her – Emilie, the barista, with her bright smile and sparkling eyes. As he ordered his coffee, they exchanged pleasantries, and Evan learned that Emilie was an art student with a passion for Claude Monet's impressionist masterpieces.

As the spring festival was in full swing, Evan found himself returning to the café every day, not just for the coffee, but for Emilie's warm company. They would steal moments to discuss art, sharing their favorite Monet paintings and the way the city's architecture seemed to inspire them. Their conversations flowed as smoothly as the Seine River, which they strolled along, taking in the city's majestic beauty.

As they walked, Emilie pointed out the intricate details of the bridges and buildings, while Evan shared stories of his favorite Monet works, like ""Impression, Sunrise."" The city's romantic atmosphere was palpable, and Evan found himself falling for Emilie's charming French accent and infectious laugh.

As the festival came to a close, Evan realized he didn't want to leave Paris – or Emilie. They stood on the riverbank, watching the Eiffel Tower twinkle to life, and Evan knew he had found a kindred spirit in this beautiful city. As they shared a tender kiss under the stars, Evan whispered, ""Je t'aime, Emilie"" – and he knew this was just the beginning of their own masterpiece.",4.53512933874242,umd,hugging-quants/Meta-Llama-3.1-70B-Instruct-AWQ-INT4,29.50372886657715
8,"Evan, an American tourist, wandered through the vibrant streets of Paris during the spring festival, taking in the sights and sounds of the city. As he sipped on a coffee at a charming café, he couldn't help but notice the barista, Emilie. Her bright smile and sparkling eyes captivated him, and he found himself lingering at the counter, chatting with her about everything from art to architecture.

As they talked, Evan discovered that Emilie shared his passion for Claude Monet's 'Impression, Sunrise', the painting that had given the name to the entire Impressionist movement. Their conversation flowed easily, like the Seine River, and before he knew it, Evan had spent hours chatting with Emilie. She showed him her favorite book about Monet's work, and he was impressed by her knowledge.

As the festival continued outside, Emilie suggested they take a walk along the Seine to admire the Hotel de Sully's stunning architecture. Evan eagerly agreed, and as they strolled hand in hand, the city's magic took hold. They talked about their dreams, aspirations, and the beauty of the world around them. With every step, Evan felt himself falling for Emilie, captivated by her joie de vivre and infectious enthusiasm.

As the sun began to set, casting a golden glow over the city, Evan realized he had found a special connection with Emilie. He asked her to join him for dinner the following evening, and to his delight, she agreed. As they parted ways, Evan couldn't wait to see what the next day would bring, knowing that their budding romance was just beginning to unfold.",4.171041879608233,umd,hugging-quants/Meta-Llama-3.1-70B-Instruct-AWQ-INT4,30.98065423965454
9,"Evan, an American tourist, strolled through the vibrant streets of Paris during the spring festival, taking in the sights and sounds of the city. As he waited in line at a charming café, he couldn't help but notice Emilie, the barista, with her bright smile and sparkling eyes. As he ordered his coffee, they struck up a conversation about the beauty of the city. Evan mentioned his love for Claude Monet's ""Impression, Sunrise,"" and to his surprise, Emilie shared his passion for the painting.

As they chatted, Evan learned that Emilie was an art student, and her knowledge of the city's architecture was impressive. She pointed out the intricate details of the Hotel de Sully, just across the street. Evan was captivated by her enthusiasm and expertise. As the festival festivities filled the air, Emilie invited Evan to take a walk along the Seine, and he eagerly accepted.

As they strolled hand in hand, the city's magic worked its way into their hearts. They laughed and discovered hidden gems, like the charming streets of Le Marais. Their connection deepened with each step, and Evan found himself feeling more at home in the city with Emilie by his side. As the sun began to set, casting a golden glow over the Seine, Evan realized he had fallen for the charming barista. And as they shared a kiss under the twinkling lights of the city, he knew this chance encounter had become something more.",4.156921938165305,umd,hugging-quants/Meta-Llama-3.1-70B-Instruct-AWQ-INT4,28.337642908096313
10,"As the spring festival illuminated the streets of Paris, Evan found himself wandering the charming streets of Le Marais, taking in the vibrant atmosphere. That's where he stumbled upon a quaint café, where Emilie, with her bright smile and sparkling eyes, was expertly crafting coffee art. Their initial exchange revolved around Evan's fascination with Claude Monet's 'Impression, Sunrise,' a painting that Emilie also adored. As they delved into the world of art and architecture, their conversation flowed effortlessly, like the Seine River that ran through the city.

Evan's curiosity about the Hotel de Sully's intricate design led Emilie to take him on a tour of the historic building. As they strolled along the Seine, the city's magic wove a spell around them. Laughter and adventure filled their days, with Emilie introducing Evan to the hidden gems of Le Marais. As the festival lights danced on the river, Evan realized his connection with Emilie had blossomed into something more. Under the starlit sky, he mustered the courage to express his feelings. ""From the moment I met you, Emilie, I knew this was something special,"" he said, his voice filled with sincerity. ""I promise to cherish every moment we've shared, even as our time together comes to a close."" Emilie's heart skipped a beat as she smiled, knowing that their whirlwind romance would remain a treasured memory, forever etched in the city of love.",5.294005106365612,umd,hugging-quants/Meta-Llama-3.1-70B-Instruct-AWQ-INT4,28.475494146347046
