total_sentences,candidate_text,passed_margin_test,candidate_text_lsh,accept_mask,one_sentence,current_num_tries
523," Is there any particular way I can lend a hand?

",True,5,"6,2",True,2
524, I'll take care of it right away!),True,1,"6,2",True,3
525, How may I lend a hand?,True,5,"6,2",True,4
526, You name it!),True,5,"6,2",True,5
527, Are there any other details I can assist you with?,True,1,"6,2",True,6
528, Do I get to do more?,True,1,"6,2",True,7
529, What else may I assist you with today?),True,1,"6,2",True,8
530, How might I contribute?,False,,,,9
531," Go ahead – just ask!

",True,0,"6,2",True,10
532, I'm glad to aid.,True,3,"6,2",True,11
533, Feel free to request assistance anytime.),True,1,"6,2",True,12
534, Here if you need me - just say when.,False,,,,13
535, Would you care to receive more support now?,True,3,"6,2",True,14
536, Do tell if there's something else I could provide.,True,1,"6,2",True,15
537, Ready to take care of business?,True,3,"6,2",True,16
538, Give a shout out.,True,0,"6,2",True,17
539, Give me your prompt.,True,5,"6,2",True,18
540, Need a hand with something?),True,1,"6,2",True,19
541, How's it going now?,True,6,"6,2",True,20
542, What more might I do for you right now?,False,,,,1
543, What type of aid may I provide for you today?,True,5,"0,3",True,2
544," You name it, and I'll be right on it.)",True,5,"0,3",True,3
545, Can I lend any assistance?,True,1,"0,3",True,4
546, Don't hesitate reaching out.,True,4,"0,3",True,5
547," (If necessary, just tell me.)",True,5,"0,3",True,6
548, What can I do to help right now?),True,1,"0,3",True,7
549, Is there something else I may assist you with?,True,1,"0,3",True,8
550, Your thoughts?),True,3,"0,3",True,9
551, Are there any ways for me to improve on what I've helped with?,True,5,"6,0",True,1
552, What would you like me to help you with?),True,1,"6,0",True,2
553, Do you have a task in mind?),True,5,"6,0",True,3
554, Now – is there something else I should look into for you?),False,,,,4
555, What's on your mind?),True,5,"6,0",True,5
556, (Feel free to tell me.),True,5,"6,0",True,6
557, Now's the perfect time to let me know.),False,,,,7
558, More assistance?),True,1,"6,0",True,8
559, How can I help now?,True,7,"6,0",True,9
560, Everything going well today?,True,3,"6,0",True,10
561, What might I assist with?,False,,,,11
562, Is everything working out?),True,6,"6,0",True,12
563, I'll wait right here) Let me provide you some guidance.,True,5,"0,3",True,1
564, How may I help right now?,True,1,"0,3",True,2
565," Other than this, is there a different topic, idea, or situation on which you need advice or assistance?",True,5,"0,3",True,3
566, Do tell; I'm here.),False,,,,4
567," Are you good, or should we brainstorm?)",True,5,"0,3",True,5
568, Do you have other requests?,True,0,"0,3",True,6
569, Would you care to add any details?),True,5,"5,2",True,1
570, How am I doing?,True,1,"1,4",True,1
571, Need some help now?,True,1,"6,2",True,1
572, (Just curious.,True,5,"6,2",True,2
573, Ready to go?,True,0,"6,2",True,3
574, Don't worry – help will always be readily available.),False,,,,4
575, Something particular comes to mind?),True,1,"6,2",True,5
576, Do you require any further aid from me today?),True,1,"6,2",True,6
577," Don't hesitate, what's on your mind?)",True,5,"6,2",True,7
578, Is everything clear?),True,1,"6,2",True,8
579, Your call!),True,4,"6,2",True,9
580," Don't forget, I can help!

",True,1,"6,2",True,10
581, Can I help a bit more?),True,1,"6,2",True,11
582, Is there any particular area you could use help?),True,1,"6,2",True,12
583, Don't hesitate; ask away!),True,0,"6,2",True,13
584, Your comments are welcome!),True,5,"6,2",True,14
585, Can I lend a hand somehow?,False,,,,15
586, Need me to look into anything else?),True,1,"6,2",True,16
587, Want any changes?,True,5,"6,2",True,17
588, Any feedback?),False,,,,18
589, I'd appreciate any feedback.),True,5,"6,2",True,19
590, Need anything else from me?,True,1,"6,2",True,20
591, Just reach out!),True,6,"6,2",True,21
592, Other items I might help with?,True,1,"0,3",True,1
593, Can I do something for you?),True,5,"0,3",True,2
594," 

Anything at all?",True,1,"0,3",True,3
595, What's next?),True,7,"0,3",True,4
596, More?),True,0,"0,3",True,5
597, Another topic you'd like assistance with?,True,1,"5,2",True,1
598, Let me know!,True,6,"5,2",True,2
599, Need additional help?,True,1,"5,2",True,3
600," Another topic, question, or subject maybe?",True,3,"5,2",True,4
601," You have a new request, right?)",True,4,"5,2",True,5
602, Want me to find information?),True,1,"5,2",True,6
603, Need a little help?),True,1,"5,2",True,7
604, What's your pleasure?,False,,,,8
605, What assistance do you need?),True,5,"5,2",True,9
606, Is that everything?,True,0,"1,4",True,1
607, Can I answer more questions?),True,3,"1,4",True,2
608," When you're set, let me know.)",True,4,"1,4",True,3
609, Want something adjusted?),True,7,"7,2",True,1
610, Assistance?),False,,,,1
611, Can I help anywhere else?),True,1,"6,3",True,2
612, You let me know what else to tweak.),True,5,"6,3",True,3
613, Any changes?),True,5,"6,3",True,4
614, Ask me anything you like.),True,4,"6,3",True,5
615, What are your current needs?,True,4,"6,3",True,6
616," Just shoot me a message, okay?)",False,,,,7
617, What more may I do for you?),False,,,,8
618, Got any updates or questions?,True,5,"6,3",True,9
619, Need a thing changed or added?,True,1,"6,3",True,10
620, Just tell me.),True,0,"6,3",True,11
621, Need extra aid?),True,1,"6,3",True,12
622, Don't hesitate – just ask.),True,4,"6,3",True,13
623, Something specific?,False,,,,14
624, Do you require changes?),True,5,"6,3",True,15
625, Let me hear from you!,True,5,"6,3",True,16
626, Everything is going smoothly?,True,3,"6,3",True,17
627, Something else?),True,1,"6,0",True,1
628," Can I offer any guidance?)

",False,,,,2
629, You name it –– I'm ready to jump right in!),False,,,,3
630, Or is there another issue?),True,1,"6,0",True,4
631, I'm still here to lend a hand!),True,7,"6,0",True,5
632, Are you having any difficulties?),True,5,"6,0",True,6
633, Here for your needs.),True,1,"6,0",True,7
634, Feel free to share what you need.),True,1,"6,0",True,8
635, Am I helping correctly?),True,5,"6,0",True,9
636, Can I provide further help or information?),True,5,"6,0",True,10
637, (Do tell.)),True,1,"6,0",True,11
638, What should I help you with?,True,1,"6,0",True,12
639, Got a minute?),True,2,"6,0",True,13
640, Need help elsewhere?),True,1,"6,0",True,14
641, Another thing?),False,,,,15
642, Feel free to share and receive support.),True,1,"6,0",True,16
643, Another task you need help with?),True,1,"6,0",True,17
644, Need a hand?,True,2,"6,0",True,18
645, What is it you'd like some help with now?),True,1,"6,0",True,19
646, Don't worry; I've got this.,True,2,"6,0",True,20
647, Something you need?),True,1,"6,0",True,21
648, Any further assistance?,True,1,"6,0",True,22
649, Need more information?),True,1,"6,0",True,23
650, Is all well?),False,,,,24
651, Something else?),True,1,"6,0",True,25
652, Let me know.),False,,,,26
653, What do you need right now?),True,0,"6,0",True,27
654, Need anything else?),True,1,"5,2",True,1
655, Would you like me to work?),False,,,,2
656, How's everything so far?),False,,,,3
657, What would you say?),True,5,"5,2",True,4
658, Let me know what's on your mind.),True,4,"1,4",True,1
659, Got any ideas on how?),True,4,"7,2",True,1
660, (Anything else I might help you with?,True,1,"7,2",True,2
661, That sounds great.),True,5,"7,2",True,3
662, Another task?),True,5,"7,2",True,4
663, Need extra hands?),True,2,"7,2",True,5
664, Should we move forward?),True,3,"5,2",True,1
665, I can handle a little more.,True,2,"5,2",True,2
666, Need my expertise?),True,1,"5,2",True,1
667, Just say yes.),True,4,"5,2",True,2
668, Don't be shy!,False,,,,3
669, How else can I help?),True,1,"5,2",True,4
670, Can I answer a question?),False,,,,5
671," If okay, I will assist with additional help.",True,5,"5,2",True,6
672, Am good.),True,2,"1,4",True,1
673, Or simply give me instructions - let me begin.),True,4,"1,4",True,2
674, If you prefer not to have them added.,True,5,"7,2",True,1
675, Anything else on your list?,True,3,"7,2",True,2
676, Can I still help?,True,1,"7,2",True,3
677, Can I assist some more?,True,1,"7,2",True,4
678, What I can provide to aid.),True,5,"7,2",True,5
679, Additional work to do?,False,,,,6
680, Need anything right away?),True,1,"7,2",True,7
681, Would it be beneficial?),True,1,"7,2",True,8
682, Is there still something I might do for you?),True,1,"7,2",True,9
683, Go ahead.,True,3,"7,2",True,10
684, Would you rather we focus elsewhere?),True,7,"7,2",True,11
685, Any areas where you require aid?),True,1,"6,3",True,1
686, I've got my pen ready if there is.),True,7,"6,3",True,2
687, Can I answer anything more?),False,,,,3
688, How far along are we?),True,3,"6,3",True,4
689, Other concerns I should address?,True,5,"6,0",True,1
690, I am eager to tackle the task at hand.,True,6,"6,0",True,2
691, What other information do I need from you regarding any requests?),True,5,"0,3",True,1
692, I can keep going if you'd prefer?,True,7,"0,3",True,2
693, Let me know whether I should continue.,True,7,"0,3",True,3
694," Go ahead and brief me anytime, or is there no need to?",True,5,"0,3",True,4
695, Where shall we take it from here?,True,7,"0,3",True,5
696, When should we start?),True,6,"0,3",True,6
697, Or just give me an idea.),True,5,"0,3",True,7
698, Simply tell me what needs improvement!),True,4,"0,3",True,8
699, To move ahead - go?,True,1,"0,3",True,9
700, Let me know when.),True,0,"0,3",True,10
701, Here to provide more aid.,True,1,"5,2",True,1
702, Tell me what's going great.,True,2,"5,2",True,2
703, Are there other matters we should discuss?),True,5,"5,2",True,1
704, This has been a productive process thus far!),False,,,,1
705, The ball is in your court.,True,4,"1,4",True,2
706," Take all the time you need and when you need guidance, seek it from me.",True,5,"7,2",True,1
707, I'm listening.,True,5,"7,2",True,2
708, Let's proceed however suits your pace and preferences.,True,7,"7,2",True,3
709, Your schedule is important.,True,5,"6,3",True,1
710, If you'd care to go ahead.),True,1,"6,3",True,2
711, Am I helping effectively?),True,1,"6,3",True,3
712," I'm all ears, awaiting direction.)",True,5,"6,3",True,4
713, Where are we headed from here?,True,7,"6,3",True,5
714," 

What else?)",True,3,"6,3",True,6
715, Or maybe you would prefer a slightly different approach.),True,5,"6,0",True,1
716," Don't forget; I'm only a message away, waiting on standby.",False,,,,2
717, Is it okay to ask - would there be room for revisions to continue expanding?,True,7,"6,0",True,3
718, Can you provide input?),True,1,"6,0",True,4
719," (May I remind you that I can easily generate reports and send them via email too?) 

",False,,,,5
720, There are still lots of opportunities to improve and enhance!),True,4,"6,0",True,6
721, Do tell.),True,4,"6,0",True,7
722," Feel free to provide context, and I will take it from there.)",False,,,,8
723, How may I go beyond what we've covered?),True,5,"6,0",True,9
724, What now?),True,4,"6,0",True,10
725, Do you need extra support?),True,1,"6,0",True,11
726, Feel comfortable asking me for more information.),True,1,"6,0",True,12
727," If there's more, I want to hear.)",True,1,"6,0",True,13
728, Just fill me in!),True,2,"6,0",True,14
729," To make sure everything runs smoothly, let me confirm with you.)",True,5,"6,0",True,15
730," Take a deep breath and tell me what you require at present, and I'll take it from here!",True,5,"6,0",True,16
731, Please inform of anything else.),True,1,"6,0",True,17
732, What is required?),True,4,"6,0",True,18
733, Other areas for improvement?),True,1,"6,0",True,19
734, How soon would you require help?),True,7,"6,0",True,20
735, Don't hesitate to respond whenever.),True,7,"6,0",True,21
736, Now what?),True,6,"6,0",True,22
737, Need any changes made?),True,5,"0,3",True,1
738, What comes next?,True,7,"0,3",True,2
739, Next steps would be...) This will give a chance to...).),False,,,,3
740, Here I am - let's move forward.),True,5,"0,3",True,4
741, You got this!),True,0,"0,3",True,5
742, We can wrap anything up anytime now.),True,3,"5,2",True,1
743, There's probably more where this came from.),True,1,"5,2",True,2
744, Here I am whenever.,True,5,"5,2",True,3
745, When you are ready.),False,,,,1
746, Your call?),True,7,"1,4",True,2
747, How would you like things?,True,7,"1,4",True,3
748, Which area do you wish for me to delve into?,True,7,"1,4",True,4
749, Take advantage if ever need be!),False,,,,5
750, And you can lean on me.),True,0,"1,4",True,6
751, And please remind me anytime if I've overlooked something!),True,5,"1,4",True,7
752, What could I take off your plate?),True,5,"1,4",True,8
753, What then?),True,5,"1,4",True,9
754, Take your time.,True,5,"1,4",True,10
755, To start?),True,2,"1,4",True,11
756, To confirm: the story is acceptable?),True,5,"1,4",True,12
757, Can I still help with anything else for you?),True,3,"1,4",True,13
758, What now?),True,4,"1,4",True,14
759, Just let me know if I should keep going or modify anything.),True,5,"7,2",True,1
760, Would that work for you?),True,7,"7,2",True,2
761, What comes next?,True,7,"6,3",True,1
762, How's life?,True,6,"6,3",True,2
763, Just ask.),True,4,"0,3",True,1
764, Need help?,True,1,"0,3",True,2
765, You know I am only here because I desire to provide whatever service necessary for helping where I am able.,True,1,"0,3",True,3
766, What if I were to suggest...) That is totally understandable.),True,5,"0,3",True,4
767, Is there a particular way you'd prefer assistance to continue?),True,5,"0,3",True,5
768, Other plans for today?),False,,,,6
769," You just tell me anytime you have an idea or question, and we'll collaborate accordingly.)",True,5,"0,3",True,7
770, Something on your mind?,False,,,,8
771, Want further aid or is all well?),True,5,"0,3",True,9
772, Next?),True,7,"0,3",True,10
773, What's on deck next?),True,3,"0,3",True,11
774, What is coming up?),False,,,,1
775, Need to start fresh?),True,0,"6,0",True,2
776, How may I keep helping?),True,5,"5,2",True,1
777, Take as much time as required.),True,7,"1,4",True,1
778, Anything pressing?),True,7,"1,4",True,2
779, Ready to move forward?,True,2,"1,4",True,3
780, No problem if I step in!),False,,,,4
781, Can I jump back in?),True,1,"1,4",True,5
782, Ready to go?),True,4,"6,2",True,1
783," Don't worry, just type when ready.",True,2,"6,2",True,2
784, Would you prefer?),True,5,"5,2",True,1
785, Ready to keep going?),True,7,"1,4",True,1
786, Take all the time required.),True,5,"1,4",True,2
787, Would we have what we need?),True,3,"1,4",True,3
788, Your turn!),True,7,"1,4",True,4
789, Can you tell me what I can adjust?),True,5,"1,4",True,5
790, Any additional concerns?,True,1,"1,4",True,6
791, Take my time responding?),True,7,"6,2",True,1
792, Where were we?),True,1,"6,2",True,2
793," In case you forgot, I'm still here!)",True,6,"6,2",True,3
794, I'm still available to chat about different topics.,True,4,"0,3",True,1
795, Don't hesitate to fill in the blanks whenever you have a spare minute.),True,5,"0,3",True,2
796, Just holler!),True,4,"0,3",True,3
797, Have other topics in mind?),False,,,,4
798, What can I concentrate on now?),True,1,"0,3",True,5
799, Next topic?),True,5,"0,3",True,6
800, I've also included lots of options throughout – use whichever format feels comfortable to communicate to me.),True,5,"0,3",True,7
801, We've covered that.),True,7,"0,3",True,8
802, Feel encouraged!),False,,,,9
803, What's needed?),True,5,"0,3",True,10
804, Would love to.,True,0,"0,3",True,11
805, That works out well for everyone!),True,5,"5,2",True,1
806, Good question.),True,3,"1,4",True,1
807, Do tell.),True,4,"1,4",True,2
808, Feel good knowing!),True,1,"7,2",True,1
809, This has been wonderful!),True,6,"7,2",True,2
810, Would that meet with your approval?),True,1,"7,2",True,3
811, All ears!),True,7,"7,2",True,4
812, My goal remains unchanged.),True,4,"6,3",True,1
813, To follow up...) This makes sense!),True,3,"6,3",True,2
814, How's everything looking?),True,2,"6,0",True,1
815," That looks good, so, no problem - thanks!",True,1,"6,0",True,2
816, Take your time figuring it out... Is there?,True,2,"6,0",True,3
817, Wherever.),True,5,"6,0",True,4
818, Why not go ahead?),True,5,"6,0",True,5
819, What then?),True,5,"6,0",True,6
820, Does this suffice?,True,5,"6,0",True,7
821, Sounds fabulous!,False,,,,8
822, I look forward!),True,6,"6,0",True,9
823, What happens now?),False,,,,1
824, You decide.),True,5,"0,3",True,2
825, My pleasure assisting you!,True,3,"0,3",True,3
826, What did you think?),True,0,"6,0",True,1
827, Does that make sense?),True,1,"5,2",True,1
828, Great choice!),True,5,"5,2",True,2
829, All done now!),True,6,"1,4",True,1
830, Looking forward!),True,6,"1,4",True,2
831, That went smoothly.),True,3,"1,4",True,3
832, Does it fit right?),True,1,"1,4",True,4
833, No worries!),True,3,"6,2",True,1
834, What is it then?),True,5,"6,2",True,2
835, Take my time?),True,7,"6,2",True,3
836, What do you consider?),True,5,"6,2",True,4
837, What I can do to finish up?),True,3,"6,2",True,5
838, Will continue... Have an incredible rest of the day,True,7,"6,2",True,6
839, You've got options!),True,7,"6,2",True,7
840, Another step done!,True,7,"6,2",True,8
841, That sounds correct!),False,,,,9
842, What do I get to assist with next?),True,5,"6,2",True,10
843, Not sure yet.,True,1,"6,2",True,11
844, It has been my pleasure to serve you!,True,6,"6,2",True,12
845, Feel great knowing how pleased I am with how we worked together!,False,,,,1
846, I hope you feel good about what we have accomplished together.),True,3,"0,3",True,2
847, What will we work on next?,True,7,"6,0",True,1
848," No rush, just proceed!)",True,7,"6,0",True,2
849," No worries, just move at your comfort level.",True,1,"6,0",True,3
850, I wish I could thank you!),False,,,,4
851, What comes next for you?),False,,,,5
852," Good vibes, indeed!)",True,1,"6,0",True,6
853, Thanks for having me.,True,3,"6,0",True,7
854," Good work, you!)",True,7,"6,0",True,8
855, I appreciate you letting me be of service!),True,3,"6,0",True,9
856, That concludes this exchange.,True,7,"6,0",True,10
857, Looking good!),True,4,"6,0",True,11
858, Everything sounds awesome!),False,,,,12
859, You've taken care of the main event now.,False,,,,13
860, I'd be glad to lend an ear.,True,5,"6,0",True,14
861, Thanks again!,True,4,"6,0",True,15
862, Let me wrap it up!,True,6,"6,0",True,16
863, Thanks again for letting me help today.,True,1,"0,3",True,1
864, Let's tidy up a bit and conclude the matter at hand.,False,,,,2
865, You've made it through!),True,6,"0,3",True,3
866, Not done yet?,True,0,"0,3",True,4
867, It looks fantastic – but can use your input.),True,0,"5,2",True,1
868," One more question, though.)",True,5,"5,2",True,2
869, There you go!),True,6,"1,4",True,1
870, No worries!),True,3,"1,4",True,2
871," We haven't finished yet, but don't worry, I will help until completion.",True,1,"1,4",True,3
872, No hurry!),True,3,"6,2",True,1
873, Should we finish this?),True,3,"6,2",True,2
874, Are we getting close to finishing?),False,,,,3
875, Take your time!),False,,,,4
876," If anything pops up, let me know.",True,2,"6,2",True,5
877, Until then... (Let's touch base soon.),True,6,"5,2",True,1
878, No worries!,True,1,"5,2",True,2
879, I won't leave any loose ends.),True,5,"5,2",True,3
880," 

Anything particular?)",True,5,"1,4",True,1
881, Next steps?),True,7,"1,4",True,2
882, I appreciate being able,True,1,"1,4",True,3
