total_sentences,candidate_text,passed_margin_test,candidate_text_lsh,accept_mask,one_sentence,current_num_tries
1,"

It was a busy Monday morning for Emily, the marketing manager at a large corporation.",True,3,"1,4",True,1
2,"

As I stepped into the office, my boss greeted me with a frazzled expression. """,True,0,"1,4",True,2
3,"

As I walked into the cozy little café, the aroma of freshly brewed coffee and baked goods enveloped me, instantly lifting my mood.",True,1,"1,4",True,3
4," It was a typical Monday morning, and I needed a boost to tackle the busy day ahead.",True,3,"6,2",True,1
5," I had been feeling overwhelmed with work and life in general, and my friend Sarah had suggested we meet here for a much-needed break.

",True,7,"6,2",True,2
6," It was a typical Monday morning, and I was running late for work.",True,3,"6,2",True,3
7," It was a chilly autumn morning, and I had decided to take a break from work to treat myself to a warm cup of joe.

",True,1,"6,2",True,4
8," I had been struggling to get out of bed that morning, but the prospect of meeting Sarah here for our weekly catch-up session was just what I needed.

",True,3,"6,2",True,5
9," I was meeting Emily, my best friend since college, for our weekly catch-up session.",True,7,"6,2",True,6
10, I had been running errands all morning and was in desperate need of a break.,True,7,"6,2",True,7
11," It was a typical Monday morning, and I had just gotten off a chaotic phone call with a client.",True,3,"6,2",True,8
12," It was a chilly winter morning, and I had been looking forward to this break all week.",True,3,"6,2",True,9
13," It was a typical Monday morning, and I had just finished a chaotic week of meetings and deadlines.",True,3,"6,2",True,10
14," It was a typical Monday morning, and I needed a boost to get through the day.",True,3,"6,2",True,11
15," It was a drizzly Wednesday morning, and I needed a pick-me-up to tackle the day ahead.",True,1,"6,2",True,12
16," I was there to meet Sarah, my best friend since college.",False,,,,13
17," It was a chilly autumn morning, and the warm atmosphere inside was just what I needed to start my day off right.

",True,1,"6,2",True,14
18," It was a typical Monday morning, and I had just arrived at my favorite spot to get some work done before the hustle and bustle of the day began.

",False,,,,15
19," I was meeting Emma, my best friend since college, for our monthly catch-up session.",True,7,"6,2",True,16
20," It was a typical Monday morning, and I needed a boost to tackle the busy day ahead.",True,3,"6,2",True,17
21," I spotted Emma, my busy entrepreneur friend, hunched over her laptop, typing away with a look of intense focus on her face.",True,3,"6,2",True,18
22," It was a chilly autumn morning, and I had just finished a long walk in the park to clear my head.",True,1,"6,2",True,19
23, I had just finished a long week at work and was looking forward to a relaxing weekend.,True,7,"6,2",True,20
24," I had been struggling to find inspiration for my novel all morning, but as I settled into my favorite corner table by the window, I felt a spark ignite within.

",True,7,"6,2",True,21
25," It was a typical Monday morning, and I was already feeling overwhelmed with tasks to tackle at work.",True,3,"6,2",True,22
26," I had been feeling overwhelmed with work and life in general, and my best friend, Rachel, had suggested we meet here for a much-needed break.

",False,,,,23
27," It was a chilly autumn morning, and I had promised my best friend, Emma, that I'd meet her here to catch up.

",False,,,,24
28," It was a chilly winter morning, and all I needed was a warm cup of joe to start my day off right.",True,1,"6,2",True,25
29, It was going to be one of those days - the kind where everything seemed to be going wrong.,True,3,"6,2",True,26
30," It was a chilly autumn morning, and I had just finished a grueling exam at university.",False,,,,27
31," I was meeting Emma, my best friend since college, for our weekly catch-up session.",True,7,"6,2",True,28
32," It was a chilly autumn morning, and the warm atmosphere inside was just what I needed to start my day off right.

",True,1,"6,2",True,29
33," It was a typical Monday morning, and I needed a boost to get going.",True,3,"6,2",True,30
34," I was there to meet Emily, a busy entrepreneur who needed some assistance with her schedule.",True,1,"6,2",True,31
35," It was a chilly autumn morning, and I was grateful to have escaped the rain-soaked streets outside.",False,,,,32
36," It was a typical Monday morning, and I had a long to-do list staring back at me from my notebook.",True,3,"6,2",True,33
37," It was a typical Monday morning, and I had just enough time to grab a quick breakfast before a packed day at work.

",True,1,"6,2",True,34
38," It was a chilly autumn morning, and I had just received an unexpected email from my boss, requesting a meeting to discuss a new project.

",False,,,,35
39," I spotted Emma, my friend, sitting at a corner table by the window, typing away on her laptop.",True,1,"6,2",True,36
40," I had been struggling to meet a looming deadline for a project at work, and my mind was feeling foggy.",False,,,,37
41," It was going to be one of those days where everything felt overwhelming, but as I took a seat at the small table by the window, I knew I could tackle it all.

",True,0,"6,2",True,38
42," It was a chilly autumn morning, and the warm atmosphere inside was just what I needed to shake off the chill.

",True,1,"6,2",True,39
43," It was a drizzly Wednesday morning, and I had just received an email from my boss requesting a last-minute report to be submitted by the end of the day.",True,0,"6,2",True,40
44," It was a drizzly Monday morning, and I had just received an email from my boss that required immediate attention.",True,3,"6,2",True,41
45," It was a chilly autumn morning, and the warm atmosphere inside was just what I needed to shake off the lingering sleepiness.",True,1,"6,2",True,42
46," I was running late for a meeting with Emily, my close friend since college.",True,5,"6,2",True,43
47," I was meeting Emma, a friend from college, for a catch-up session.",True,7,"6,2",True,44
48," It was a chilly autumn morning, and I had been looking forward to this solo breakfast date all week.",False,,,,45
49," I was meeting Emma, my best friend since college, for our weekly catch-up session.",True,7,"6,2",True,46
50," I was meeting Emma, a friend from college, for our monthly catch-up session.",True,7,"6,2",True,47
51," It was a chilly autumn morning, and I had just arrived for my first day as a personal assistant to Emma, the owner.

",True,3,"6,2",True,48
52," It was a chilly autumn morning, and I had decided to treat myself to a warm breakfast before tackling the busy day ahead.

",True,1,"6,2",True,49
53," It was a chilly autumn morning, and I had scheduled to meet my best friend, Emma, here for a much-needed catch-up session.

",True,3,"6,2",True,50
54,"I spotted Emma already seated at our favorite corner table by the window, sipping on a steaming cup of latte.",True,1,"6,0",True,1
55,"I spotted Emma sitting by the window, sipping on a latte, her eyes scanning the room as she searched for me.",True,1,"6,0",True,2
56,"I spotted Emma already seated by the window, sipping on a latte.",True,1,"6,0",True,3
57,"I spotted Emma already seated by the window, sipping on a latte and typing away on her laptop.",True,3,"6,0",True,4
58,"As I waited in line to order, I couldn't help but notice an elderly lady struggling to carry her tray of breakfast items to a table.",True,7,"6,0",True,5
59,"As I waited for her to arrive, I took a seat by the window, watching as the golden leaves rustled in the gentle breeze outside.",True,3,"6,0",True,6
60,"I spotted her already seated by the window, typing away on her laptop.",True,3,"6,0",True,7
61,"As I waited in line to order, I couldn't help but notice a young woman sitting alone at a small table by the window.",True,3,"6,0",True,8
62,"I spotted Emma already seated by the window, sipping on a latte and scrolling through her phone.",True,3,"6,0",True,9
63,"I spotted Emma already seated at our favorite corner table by the window, sipping on a steaming cup of coffee.",True,1,"6,0",True,10
64,"As I waited for her arrival, I noticed an elderly woman sitting alone at a table near the window, sipping on a cup of tea.",True,5,"6,0",True,11
65,"As I waited in line to order our drinks, I noticed an elderly woman struggling to carry her belongings while trying to balance her tray with two steaming cups of coffee.",True,7,"6,0",True,12
66,"I spotted Emma sitting by the window, typing away on her laptop.",True,3,"6,0",True,13
67,"I spotted her already seated by the window, sipping on a steaming cup of latte.",True,1,"6,0",True,14
68,"As I spotted her sitting in our favorite corner table by the window, I couldn't help but smile.",True,1,"6,0",True,15
69,"I spotted Emma already seated by the window, sipping on a latte, her eyes fixed on her phone.",True,3,"6,0",True,16
70,"As I waited for Emma to arrive, I took a seat by the window and pulled out my phone to check the time.",True,3,"6,0",True,17
71,"I spotted Emma sitting by the window, sipping on a latte and scrolling through her phone.",True,3,"6,0",True,18
72,"Just as I spotted her waving at me from across the room, my phone buzzed with an urgent message from work.",True,3,"6,0",True,19
73,"Just as I spotted her waving at me from our favorite corner table, my phone buzzed in my pocket.",True,3,"6,0",True,20
74,"I spotted her already seated at our favorite corner table by the window, sipping on a latte.",True,1,"6,0",True,21
75,"I spotted Emma already seated at our favorite table by the window, sipping on a steaming cup of latte.",True,1,"6,0",True,22
76,"I spotted her already seated at our favorite corner table by the window, sipping on a steaming cup of cappuccino.",True,3,"6,0",True,23
77,"As I scanned the bustling café, my eyes landed on Emma, already seated at our favorite corner table by the window.",True,3,"6,0",True,24
78,"As I waited in line to order our drinks, I couldn't help but notice an elderly woman sitting alone at a small table by the window.",True,3,"6,0",True,25
79,"As I waited for her to arrive, I took a seat by the window and pulled out my planner to review our agenda for the day.",True,5,"6,0",True,26
80,"I spotted Emma already seated by the window, sipping on a steaming cup of latte.",True,1,"6,0",True,27
81,"I spotted Emma already seated at our favorite corner table, sipping on a steaming cup of latte.",True,3,"6,0",True,28
82,"As I scanned the room, I spotted Emma already seated by the window, sipping on a latte.",False,,,,29
83,"As I waited in line, I noticed an elderly woman struggling to carry her tray with a cup of coffee and a pastry.",True,7,"6,0",True,30
84,"I spotted her already seated at our favorite corner table, sipping on a warm latte.",True,3,"6,0",True,31
85,"I spotted her sitting by the window, sipping on a latte, and made my way over.",True,1,"6,0",True,32
86,"I spotted her already seated by the window, typing away on her laptop.",True,3,"6,0",True,33
87,"I spotted her already seated at our favorite corner table by the window, typing away on her laptop.",True,3,"6,0",True,34
88,"As I waited for her arrival, I noticed an elderly woman sitting by herself at a table near the window.",True,5,"6,0",True,35
89,"As I waited for her to arrive, I couldn't help but notice the busy atmosphere.",True,3,"6,0",True,36
90,"I spotted Emma already seated by the window, sipping on a latte.",True,1,"6,0",True,37
91,"I spotted Emma already seated at our favorite corner table by the window, sipping on a latte.",True,1,"6,0",True,38
92,"I spotted Emma sitting in our favorite corner spot by the window, typing away on her laptop.",True,1,"6,0",True,39
93,"As I waited for her arrival, I took a seat by the window and noticed an elderly woman sitting alone at a nearby table, staring out the window with a mixture of sadness and nostalgia etched on her face.",True,1,"6,0",True,40
94,"As I waited for her to arrive, I took a seat by the window and pulled out my phone to respond to some pending messages.",True,7,"6,0",True,41
95,"I spotted her sitting by the window, sipping on a latte, and waved at her as I joined the short queue.",False,,,,42
96,"I spotted Emma already seated by the window, typing away on her laptop.",True,3,"6,0",True,43
97,"As I scanned the room, my eyes landed on Emma, already seated at our favorite corner table by the window.",True,3,"6,0",True,44
98,"I spotted Emma already seated by the window, typing away on her laptop.",True,3,"6,0",True,45
99,"I spotted Emma already seated by the window, typing away on her laptop.",True,3,"6,0",True,46
100,"Just as I spotted Emma sipping on a latte in the corner, my phone buzzed with an urgent work email.",True,3,"6,0",True,47
101,"Just as I spotted Emma sipping on a latte in the corner, my phone buzzed with an urgent text from my boss.",True,3,"6,0",True,48
102,"I spotted her already seated at our favorite table by the window, sipping on a latte and typing away on her laptop.",True,3,"6,0",True,49
103,"I spotted her already seated by the window, sipping on a latte.",True,1,"6,0",True,50
104," She smiled brightly as I approached, and we hugged warmly before sitting down.

",True,3,"6,2",True,1
105, We exchanged warm smiles as I slid into the chair across from her.,True,3,"6,2",True,2
106," She smiled brightly as I approached, and we exchanged warm hugs before settling in across from each other at the small table.

",True,3,"6,2",True,3
107," We exchanged warm hugs, and I settled in across from her.",True,3,"6,2",True,4
108, Her bright smile lit up as she saw me approach.,True,3,"6,2",True,5
109," We hugged each other tightly, exchanging warm smiles.",True,3,"6,2",True,6
110," We exchanged warm hugs, and I took a seat across from her.",True,7,"6,2",True,7
111, We hugged warmly as I settled in across from her.,True,3,"6,2",True,8
112," We hugged each other tightly, exchanging warm smiles as we settled in for our chat.",True,3,"6,2",True,9
113," Her eyes sparkled as she waved me over, and we exchanged warm hugs before settling in.",True,3,"6,2",True,10
114, Her bright smile greeted me as I approached our table.,True,2,"6,2",True,11
115," We hugged warmly, and I slid into the chair across from her.

",True,3,"5,2",True,1
116," We hugged warmly before sitting down, and I couldn't help but notice the concerned look in her eyes.

",True,3,"5,2",True,2
117," We hugged each other warmly before I took a seat across from her.

",True,3,"5,2",True,3
118," We hugged warmly, and I couldn't help but notice the spark in her eyes – she looked radiant!

",True,1,"5,2",True,4
119," We exchanged warm hugs, and I couldn't help but notice the stack of files and papers spread out before her.

",True,3,"5,2",True,5
120," We exchanged warm hugs and settled in, chatting about everything from our jobs to our love lives.

",False,,,,6
121," We hugged warmly, exchanging pleasantries about each other's week.

",True,3,"5,2",True,7
122," We hugged each other tightly, exchanging warm hellos before settling in.

",True,3,"5,2",True,8
123," We exchanged warm hugs before I settled in across from her.

",True,3,"5,2",True,9
124," We hugged warmly before sitting down across from each other.

",True,3,"5,2",True,10
125," We exchanged warm hugs, and I couldn't help but notice the concerned look on her face.

",True,3,"5,2",True,11
126," We hugged warmly, and I slid into the chair across from her.

",True,3,"5,2",True,12
127," We hugged warmly, exchanging apologies for not having seen each other in months.

",True,7,"5,2",True,13
128," We hugged warmly before I settled in across from her.

",True,3,"5,2",True,14
129," We hugged each other warmly before settling in.

",True,3,"5,2",True,15
130," We exchanged warm hugs, and I settled in, eager to chat about everything that had been happening in our lives.

",True,3,"5,2",True,16
131," We spent the next hour reminiscing about old times, sharing laughter and stories of our adventures.",False,,,,17
132," We hugged warmly, and I settled in beside her.

",True,3,"5,2",True,18
133," We hugged warmly, and I took a seat across from her.",True,7,"5,2",True,19
134," We exchanged warm hugs before I sat down across from her.

",False,,,,20
135," We exchanged warm hugs and settled in for what promised to be a lovely conversation.

",True,3,"5,2",True,21
136," We hugged warmly before I took a seat across from her.

",True,3,"5,2",True,22
137," We spent the first few minutes exchanging warm hugs and pleasantries before diving into more serious conversations.

",True,2,"5,2",True,23
138,"Emma confided in me about her struggles with work stress, and I listened intently, offering words of encouragement and advice whenever she needed it.",True,1,"5,2",True,1
139,"Emma confided in me about her struggles at work, feeling overwhelmed with her new role and struggling to manage her team's expectations.",True,5,"5,2",True,2
140," I listened attentively, offering words of encouragement and suggesting strategies she could try to better prioritize her tasks.

",True,1,"1,4",True,1
141,"As we chatted, a young artist sat down beside us, sketching the scene unfolding outside the café.",True,1,"6,2",True,1
142,"In return, Emma asked about my latest projects and listened intently as I shared my passion for writing and photography.",True,1,"6,2",True,2
143,"In return, I shared my own fears about starting a new project at home, which I'd been putting off due to self-doubt.",True,1,"6,2",True,3
144,"Just then, the barista arrived with our orders – two steaming cups of hot chocolate, topped with fluffy whipped cream and sprinkles.",True,1,"6,2",True,4
145,"As we chatted, I pulled out my planner and started jotting down some notes. """,False,,,,5
146,"As we chatted, a young woman sitting nearby caught my eye.",True,3,"6,2",True,6
147,"As we chatted, I noticed a young woman sitting across from us, typing away on her laptop.",True,3,"6,2",True,7
148,"As we chatted, our conversation turned to our shared love of travel, and I began regaling her with tales from my recent trip to Europe.",True,7,"6,2",True,8
149,"As we chatted, the barista brought over a tray of steaming hot croissants and a selection of fruit preserves.",True,5,"6,2",True,9
150,"Just then, the waitress arrived to take our order.",True,3,"6,2",True,10
151,"In turn, I shared with her my own anxieties about an upcoming presentation I needed to give.",True,5,"6,2",True,11
152,"As we chatted, the sun peeked through the windows, casting a warm glow over our table.",True,1,"6,2",True,12
153,"In return, Emma shared some valuable advice on how to tackle my own creative project that had been stalled for months.",True,1,"6,2",True,13
154,"As we chatted, the barista arrived with our order – a tray laden with an assortment of croissants, muffins, and scones.",True,5,"6,2",True,14
155,"In return, Emma asked about my recent travels, and we spent the next hour reminiscing about our past adventures together.",True,7,"6,2",True,15
156,"In turn, I shared with her my own excitement about an upcoming art exhibition I had been preparing for months.",True,5,"6,2",True,16
157,"In return, Emma shared some valuable advice with me about my own endeavors.",True,1,"6,2",True,17
158,"As we chatted, a soft melody floated through the speakers, accompanied by the gentle hum of chatter from other patrons.",True,1,"6,2",True,18
159,"In turn, I shared my own challenges – balancing work and family life while trying to pursue my passion for photography.",True,5,"6,2",True,19
160,"As we chatted, I pulled out my trusty notebook and jotted down some reminders to help her stay organized.",False,,,,20
161,"In return, I shared my own concerns about an upcoming project deadline, feeling anxious about meeting the client's demands.",False,,,,21
162,"In return, Emma asked about my own life, inquiring about my latest writing projects.",True,7,"6,2",True,22
163,"As we chatted, a gentle rain began to fall outside, creating a soothing melody that complemented our conversation perfectly.",True,1,"6,2",True,23
164,"As we chatted, our conversation flowed effortlessly from one topic to another – relationships, hobbies, and even our childhood memories.",False,,,,24
165,"As we chatted, a young barista, Sophie, stopped by our table to refill our drinks and introduce herself.",False,,,,25
166,"As we chatted, our orders arrived – delicious-looking pastries and steaming hot beverages that filled the air with even more heavenly scents.",True,0,"6,2",True,26
167,"As we chatted, our barista expertly juggled multiple orders while efficiently juggling tables, never once breaking his friendly demeanor.",True,0,"6,2",True,27
168,"As we chatted, I couldn't help but notice a young woman sitting across from us, typing away on her laptop.",True,3,"6,2",True,28
169,"As we chatted, I jotted down some key takeaways and action items in my notebook. """,True,5,"6,2",True,29
170,"In return, Emma asked about my recent job search, and we brainstormed potential opportunities that aligned with my passions.",True,3,"6,2",True,30
171,"As we chatted, the barista expertly crafted our orders – a cappuccino for me and a muffin for Emma.",True,5,"6,2",True,31
172,"In return, Emma offered valuable advice on how to tackle my own challenges – juggling multiple projects simultaneously while pursuing my passion for writing.",False,,,,32
173,"Just as we were getting into the meat of our conversation, Emma's phone buzzed with an urgent text from her boss.",True,3,"6,2",True,33
174,"In return, Emma asked about my recent move to the city, and we reminisced about our old neighborhood, sharing laughs over fond memories.",True,5,"6,2",True,34
175,"In return, Emma shared some valuable insights into her recent travels, regaling me with stories of breathtaking landscapes and cultural experiences from her trip to Japan.",True,1,"6,2",True,35
176,"As we chatted, the café staff brought over a delightful spread of pastries and sandwiches.",True,5,"6,2",True,36
177,"In return, Emma asked about my latest writing project, and we geeked out over shared love for science fiction novels.",True,7,"6,2",True,37
178,"In return, she asked about my recent endeavors.",True,1,"6,2",True,38
179,"As we chatted, the sun began to peek through the clouds outside, casting a warm glow over our conversation.",True,1,"6,2",True,39
180,"In turn, I shared with her my own concerns about an upcoming project deadline and my doubts about meeting it on time.",True,1,"6,2",True,40
181,"In return, I shared with her my own struggles with finding time for hobbies and passions amidst a busy schedule.",True,7,"6,2",True,41
182,"In return, Emma asked about my own life, and I shared updates about my latest writing projects and travel plans.",False,,,,42
183,"As we chatted, our orders arrived – two fluffy croissants and a quiche that looked almost too good to eat (almost).",True,0,"6,2",True,43
184,"As we chatted, I pulled out my notebook and began jotting down some actionable tips and resources that might be helpful to her.",True,1,"6,2",True,44
185,"In return, she asked about my writing projects and offered valuable feedback on my latest manuscript.",True,7,"6,2",True,45
186,"As we chatted, I pulled out my phone and made a mental note to send her some relevant articles and resources that might help her navigate this challenging period.",True,5,"6,2",True,46
187,"In turn, I shared my own concerns about an upcoming presentation at work, which had been keeping me up at night.",True,5,"6,2",True,47
188,"As we chatted, I noticed an elderly woman sitting alone at the next table, staring out the window with a mixture of sadness and nostalgia etched on her face.",True,1,"6,2",True,48
189,"As we chatted, our conversation flowed effortlessly, covering everything from our favorite books to our childhood memories.",True,1,"6,2",True,49
190,"In return, I shared with her my excitement about an upcoming project at my own job, which I'd been nervous about taking on initially.",True,5,"6,2",True,50
191," Emma offered valuable advice on how to break it down into manageable chunks, reminding me that I had this!

",True,3,"1,4",True,1
192," Emma offered valuable insights and reminded me that I was capable of handling it.

",True,1,"1,4",True,2
193,"Our conversation flowed effortlessly, like we'd never lost touch despite being busy with our lives.",False,,,,1
194,"Our conversation flowed effortlessly, like we were two pieces of a puzzle clicking back together seamlessly.",True,3,"6,2",True,2
195,"As we chatted, the café's atmosphere only grew cozier.",True,5,"6,2",True,3
196,"Our conversation flowed effortlessly, like a gentle stream, touching upon various topics from family updates to favorite TV shows.",True,1,"6,2",True,4
197,"Our conversation flowed effortlessly, covering everything from relationships to travel plans, laughter and tears intertwined throughout.",True,1,"6,2",True,5
198,"Our conversation flowed effortlessly, covering everything from family updates to our favorite TV shows.",True,1,"6,2",True,6
199,"As we chatted, the café bustled around us – the hiss of espresso machines, laughter from nearby tables, and the occasional chime of the door opening and closing.",False,,,,7
200,"The conversation flowed effortlessly, covering everything from our favorite books to travel plans for next year.",False,,,,8
201,"Time flew by as we chatted, laughing and reminiscing about old times.",True,2,"6,2",True,9
202," Before parting ways, we made a promise to check in regularly, ensuring neither of us felt too isolated or stressed again.

",True,2,"5,2",True,1
203,"The café had provided the perfect sanctuary for our heart-to-heart conversation, reminding me that sometimes all one needs is someone to talk things through with over a steaming cup of coffee.",True,5,"5,2",True,1
